{
  "$schema": "https://json-schema.org/draft/2020-12/schema",
  "$id": "https://github.com/awcameron/skills/schemas/marketplace-registry.schema.json",
  "title": "Marketplace registry",
  "description": "Shape of .claude-plugin/marketplace.json -- what `/plugin marketplace add` reads.",
  "type": "object",
  "required": ["name", "owner", "plugins"],
  "additionalProperties": false,
  "properties": {
    "name": {
      "type": "string",
      "minLength": 1
    },
    "owner": {
      "type": "object",
      "required": ["name"],
      "additionalProperties": false,
      "properties": {
        "name": { "type": "string", "minLength": 1 },
        "email": { "type": "string" },
        "url": { "type": "string" }
      }
    },
    "description": {
      "type": "string",
      "minLength": 1
    },
    "plugins": {
      "type": "array",
      "minItems": 1,
      "items": {
        "type": "object",
        "required": ["name", "source"],
        "additionalProperties": false,
        "properties": {
          "name": { "type": "string", "minLength": 1 },
          "source": { "type": "string", "minLength": 1 },
          "description": { "type": "string" }
        }
      }
    }
  }
}
