{
  "name": "awcameron-skills",
  "owner": {
    "name": "Antonio Cameron"
  },
  "description": "Agent Skills that learn your repo's own conventions instead of imposing new ones: code review, debugging, tests, PRs, security, dependency upgrades, and doc checks. For Claude Code, Cursor, Codex CLI, Antigravity CLI, and OpenCode.",
  "plugins": [
    {
      "name": "awcameron-skills",
      "source": ".",
      "description": "Agent Skills that learn your repo's own conventions instead of imposing new ones: code review, debugging, tests, PRs, security, dependency upgrades, and doc checks. For Claude Code, Cursor, Codex CLI, Antigravity CLI, and OpenCode."
    }
  ]
}
